{
  "schemaVersion": 1,
  "repository": "kotoba-tech/dotsu-ota-test",
  "platform": "ios",
  "versions": {
    "1.4.6": {
      "otaVersion": 332319029,
      "releaseId": 332319029,
      "releaseTag": "test/0.0.42",
      "releaseName": "OTA Update ios v1.4.6",
      "publishedAt": "2026-06-01T06:43:10Z",
      "assetId": 435016009,
      "assetName": "ios-1.4.6.zip",
      "assetSize": 6099298,
      "downloadUrl": "https://github.com/kotoba-tech/dotsu-ota-test/releases/download/test/0.0.42/ios-1.4.6.zip"
    }
  }
}
